{
  "mechanism_id": "m014",
  "scope": "v0_replay",
  "description": "5 active authority validators across 3 categories with varied performance profiles. Used for deterministic KPI computation without MCP.",
  "as_of": "2026-06-01T12:00:00Z",
  "validator_fund_balance": 50000,
  "validators": [
    {
      "address": "regenvaloper1alpha",
      "moniker": "AlphaBuilder",
      "category": "infrastructure_builders",
      "status": "active",
      "term_start": "2026-01-01T00:00:00Z",
      "term_end": "2027-01-01T00:00:00Z",
      "factors": {
        "uptime": 0.999,
        "governance_participation": 0.9,
        "ecosystem_contribution": 0.85
      }
    },
    {
      "address": "regenvaloper1beta",
      "moniker": "BetaReFi",
      "category": "trusted_refi_partners",
      "status": "active",
      "term_start": "2026-01-01T00:00:00Z",
      "term_end": "2027-01-01T00:00:00Z",
      "factors": {
        "uptime": 0.997,
        "governance_participation": 0.8,
        "ecosystem_contribution": 0.7
      }
    },
    {
      "address": "regenvaloper1gamma",
      "moniker": "GammaSteward",
      "category": "ecological_data_stewards",
      "status": "active",
      "term_start": "2026-01-01T00:00:00Z",
      "term_end": "2027-01-01T00:00:00Z",
      "factors": {
        "uptime": 0.993,
        "governance_participation": 0.6,
        "ecosystem_contribution": 0.5
      }
    },
    {
      "address": "regenvaloper1delta",
      "moniker": "DeltaOps",
      "category": "infrastructure_builders",
      "status": "active",
      "term_start": "2026-01-01T00:00:00Z",
      "term_end": "2027-01-01T00:00:00Z",
      "factors": {
        "uptime": 0.980,
        "governance_participation": 0.4,
        "ecosystem_contribution": 0.3
      }
    },
    {
      "address": "regenvaloper1epsilon",
      "moniker": "EpsilonPartner",
      "category": "trusted_refi_partners",
      "status": "active",
      "term_start": "2026-03-01T00:00:00Z",
      "term_end": "2027-03-01T00:00:00Z",
      "factors": {
        "uptime": 0.996,
        "governance_participation": null,
        "ecosystem_contribution": 0.6
      }
    }
  ]
}
